{
  "$schema": "https://json-schema.org/draft/2020-12/schema",
  "$id": "https://github.com/thangldw/awesome-maintainer-defense/catalog.schema.json",
  "title": "Awesome Maintainer Defense catalog",
  "type": "object",
  "required": ["schema_version", "last_verified", "categories", "resources"],
  "additionalProperties": false,
  "properties": {
    "schema_version": {"type": "integer", "const": 1},
    "last_verified": {"type": "string", "format": "date"},
    "categories": {
      "type": "array",
      "minItems": 1,
      "items": {
        "type": "object",
        "required": ["id", "name", "description"],
        "additionalProperties": false,
        "properties": {
          "id": {"type": "string", "pattern": "^[a-z0-9-]+$"},
          "name": {"type": "string", "minLength": 3},
          "description": {"type": "string", "minLength": 20}
        }
      }
    },
    "resources": {
      "type": "array",
      "minItems": 1,
      "items": {
        "type": "object",
        "required": ["id", "name", "url", "category", "type", "license", "description", "signals", "featured"],
        "additionalProperties": false,
        "properties": {
          "id": {"type": "string", "pattern": "^[a-z0-9-]+$"},
          "name": {"type": "string", "minLength": 2},
          "url": {"type": "string", "format": "uri", "pattern": "^https://"},
          "category": {"type": "string", "pattern": "^[a-z0-9-]+$"},
          "type": {"enum": ["awesome-list", "github-action", "github-app", "templates", "tool", "working-group"]},
          "license": {"type": "string", "minLength": 2},
          "description": {"type": "string", "minLength": 24},
          "signals": {"type": "array", "minItems": 1, "items": {"type": "string", "minLength": 2}},
          "featured": {"type": "boolean"}
        }
      }
    }
  }
}
